<!ELEMENT usuarios (usuario+)>
<!ELEMENT usuario (matricula, contrasena, nombre)>
<!ELEMENT matricula (#PCDATA)>
<!ELEMENT contrasena (#PCDATA)>
<!ELEMENT nombre (#PCDATA)>